{
  "schemaVersion": "1.0",
  "id": "microsoft.graph.iosGeneralDeviceConfiguration.beta",
  "sourceUrl": "https://learn.microsoft.com/en-us/graph/api/resources/intune-deviceconfig-iosgeneraldeviceconfiguration?view=graph-rest-beta",
  "lastReviewed": "2026-08-17",
  "endpoint": "https://graph.microsoft.com/beta/deviceManagement/deviceConfigurations",
  "listEndpoint": "https://graph.microsoft.com/beta/deviceManagement/deviceConfigurations",
  "itemEndpointTemplate": "https://graph.microsoft.com/beta/deviceManagement/deviceConfigurations/{id}",
  "nameProperty": "displayName",
  "odataType": "#microsoft.graph.iosGeneralDeviceConfiguration",
  "properties": {
    "@odata.type": {
      "type": "string",
      "required": true,
      "const": "#microsoft.graph.iosGeneralDeviceConfiguration"
    },
    "displayName": {
      "type": "string",
      "required": true,
      "minLength": 1
    },
    "description": {
      "type": "string",
      "required": true,
      "minLength": 1
    },
    "activationLockAllowWhenSupervised": { "type": "boolean", "required": false },
    "airDropForceUnmanagedDropTarget": { "type": "boolean", "required": false },
    "airPlayForcePairingPasswordForOutgoingRequests": { "type": "boolean", "required": false },
    "airPrintBlockiBeaconDiscovery": { "type": "boolean", "required": false },
    "applePersonalizedAdsBlocked": { "type": "boolean", "required": false },
    "appleWatchForceWristDetection": { "type": "boolean", "required": false },
    "appStoreBlocked": { "type": "boolean", "required": false },
    "autoFillForceAuthentication": { "type": "boolean", "required": false },
    "autoUnlockBlocked": { "type": "boolean", "required": false },
    "certificatesBlockUntrustedTlsCertificates": { "type": "boolean", "required": false },
    "configurationProfileBlockChanges": { "type": "boolean", "required": false },
    "dateAndTimeForceSetAutomatically": { "type": "boolean", "required": false },
    "deviceBlockEraseContentAndSettings": { "type": "boolean", "required": false },
    "deviceBlockNameModification": { "type": "boolean", "required": false },
    "diagnosticDataBlockSubmission": { "type": "boolean", "required": false },
    "documentsBlockManagedDocumentsInUnmanagedApps": { "type": "boolean", "required": false },
    "enterpriseAppBlockTrust": { "type": "boolean", "required": false },
    "enterpriseBookBlockBackup": { "type": "boolean", "required": false },
    "enterpriseBookBlockMetadataSync": { "type": "boolean", "required": false },
    "filesNetworkDriveAccessBlocked": { "type": "boolean", "required": false },
    "filesUsbDriveAccessBlocked": { "type": "boolean", "required": false },
    "hostPairingBlocked": { "type": "boolean", "required": false },
    "iCloudBlockActivityContinuation": { "type": "boolean", "required": false },
    "iCloudBlockBackup": { "type": "boolean", "required": false },
    "iCloudBlockDocumentSync": { "type": "boolean", "required": false },
    "iCloudBlockManagedAppsSync": { "type": "boolean", "required": false },
    "iCloudBlockPhotoLibrary": { "type": "boolean", "required": false },
    "iCloudBlockPhotoStreamSync": { "type": "boolean", "required": false },
    "iCloudRequireEncryptedBackup": { "type": "boolean", "required": false },
    "keychainBlockCloudSync": { "type": "boolean", "required": false },
    "lockScreenBlockControlCenter": { "type": "boolean", "required": false },
    "lockScreenBlockNotificationView": { "type": "boolean", "required": false },
    "lockScreenBlockPassbook": { "type": "boolean", "required": false },
    "lockScreenBlockTodayView": { "type": "boolean", "required": false },
    "managedPasteboardRequired": { "type": "boolean", "required": false },
    "passcodeBlockFingerprintUnlock": { "type": "boolean", "required": false },
    "passcodeBlockSimple": { "type": "boolean", "required": false },
    "passcodeMinimumLength": { "type": "integer", "required": false, "minimum": 4, "maximum": 14 },
    "passcodeMinutesOfInactivityBeforeLock": { "type": "integer", "required": false, "minimum": 0 },
    "passcodeMinutesOfInactivityBeforeScreenTimeout": { "type": "integer", "required": false, "minimum": 0 },
    "passcodeRequired": { "type": "boolean", "required": false },
    "passcodeRequiredType": {
      "type": "string",
      "required": false,
      "enum": ["deviceDefault", "alphanumeric", "numeric"]
    },
    "passwordBlockAirDropSharing": { "type": "boolean", "required": false },
    "passwordBlockProximityRequests": { "type": "boolean", "required": false },
    "privacyForceLimitAdTracking": { "type": "boolean", "required": false },
    "safariRequireFraudWarning": { "type": "boolean", "required": false },
    "screenCaptureBlocked": { "type": "boolean", "required": false },
    "siriBlockedWhenLocked": { "type": "boolean", "required": false },
    "voiceDialingBlocked": { "type": "boolean", "required": false },
    "vpnBlockCreation": { "type": "boolean", "required": false }
  }
}
