{
  "schemaVersion": "1.0",
  "id": "microsoft.graph.iosDeviceFeaturesConfiguration.beta",
  "sourceUrl": "https://learn.microsoft.com/en-us/graph/api/resources/intune-deviceconfig-iosdevicefeaturesconfiguration?view=graph-rest-beta",
  "lastReviewed": "2026-08-18",
  "endpoint": "https://graph.microsoft.com/beta/deviceManagement/deviceConfigurations",
  "listEndpoint": "https://graph.microsoft.com/beta/deviceManagement/deviceConfigurations",
  "itemEndpointTemplate": "https://graph.microsoft.com/beta/deviceManagement/deviceConfigurations/{id}",
  "nameProperty": "displayName",
  "odataType": "#microsoft.graph.iosDeviceFeaturesConfiguration",
  "properties": {
    "@odata.type": { "type": "string", "required": true, "const": "#microsoft.graph.iosDeviceFeaturesConfiguration" },
    "displayName": { "type": "string", "required": true, "minLength": 1 },
    "description": { "type": "string", "required": true, "minLength": 1 },
    "lockScreenFootnote": { "type": "string", "required": false, "minLength": 1 }
  }
}
